{"nodes":[{"id":"Source_0","operator":{"type":"SourceOp","config":{"access":{"path":"student.json","root":"http://w3id.org/rml/MappingDirectory"},"source_type":"File","root_iterator":{"reference":"$.students[*]","reference_formulation":"JSONPath","fields":[{"alias":"$.Name","absolute_path":"$.Name","reference":"$.Name","constant":null,"iterator":null,"reference_formulation":"JSONPath","inner_fields":[]},{"alias":"$.ID","absolute_path":"$.ID","reference":"$.ID","constant":null,"iterator":null,"reference_formulation":"JSONPath","inner_fields":[]}],"alias":null}}}},{"id":"ExtendOperator_1","operator":{"type":"ExtendOp","config":{"pom_0_0_om_0":{"type":"Literal","inner_function":{"type":"Reference","value":"$.ID"},"dtype_function":null,"langtype_function":null},"pom_0_1_om_0":{"type":"Literal","inner_function":{"type":"Reference","value":"$.Name"},"dtype_function":null,"langtype_function":null},"sm_0":{"type":"Iri","base_iri":"","inner_function":{"type":"Concatenate","left_value":{"type":"Concatenate","left_value":{"type":"Concatenate","left_value":{"type":"Concatenate","left_value":{"type":"Nop"},"separator":"","right_value":{"type":"Constant","value":"http://example.com/Student/"}},"separator":"","right_value":{"type":"UriEncode","inner_function":{"type":"Reference","value":"$.ID"}}},"separator":"","right_value":{"type":"Constant","value":"/"}},"separator":"","right_value":{"type":"UriEncode","inner_function":{"type":"Reference","value":"$.Name"}}}}}}},{"id":"Serialize_2","operator":{"type":"SerializerOp","config":{"template":"?sm_0 <http://example.com/id> ?pom_0_0_om_0 <http://example.com/PersonGraph> .\n?sm_0 <http://www.w3.org/1999/02/22-rdf-syntax-ns#type> <http://xmlns.com/foaf/0.1/Person> <http://example.com/PersonGraph> .\n?sm_0 <http://xmlns.com/foaf/0.1/name> ?pom_0_1_om_0 <http://example.com/PersonGraph> .","format":"NQuads"}}},{"id":"Sink_3","operator":{"type":"TargetOp","config":{"target_type":"StdOut","data_format":"NQuads"}}}],"node_holes":[],"edge_property":"directed","edges":[[0,1,{"fragment":"default","direction":"Center"}],[1,2,{"fragment":"default","direction":"Center"}],[2,3,{"fragment":"default","direction":"Center"}]]}