{"nodes":[{"id":"Source_0","operator":{"type":"SourceOp","config":{"access":{"path":"country_es.json","root":"http://w3id.org/rml/MappingDirectory"},"source_type":"File","root_iterator":{"reference":"$.countries[*]","reference_formulation":"JSONPath","fields":[{"alias":"$.Name","absolute_path":"$.Name","reference":"$.Name","constant":null,"iterator":null,"reference_formulation":"JSONPath","inner_fields":[]},{"alias":"$.Code","absolute_path":"$.Code","reference":"$.Code","constant":null,"iterator":null,"reference_formulation":"JSONPath","inner_fields":[]}],"alias":null}}}},{"id":"Source_1","operator":{"type":"SourceOp","config":{"access":{"root":"http://w3id.org/rml/MappingDirectory","path":"country_en.json"},"source_type":"File","root_iterator":{"reference":"$.countries[*]","reference_formulation":"JSONPath","fields":[{"alias":"$.Code","absolute_path":"$.Code","reference":"$.Code","constant":null,"iterator":null,"reference_formulation":"JSONPath","inner_fields":[]},{"alias":"$.Name","absolute_path":"$.Name","reference":"$.Name","constant":null,"iterator":null,"reference_formulation":"JSONPath","inner_fields":[]}],"alias":null}}}},{"id":"ExtendOperator_2","operator":{"type":"ExtendOp","config":{"pom_0_0_om_0":{"type":"Literal","inner_function":{"type":"Reference","value":"$.Name"},"dtype_function":null,"langtype_function":{"type":"Constant","value":"en"}},"sm_0":{"type":"Iri","base_iri":"","inner_function":{"type":"Concatenate","left_value":{"type":"Concatenate","left_value":{"type":"Nop"},"separator":"","right_value":{"type":"Constant","value":"http://example.com/"}},"separator":"","right_value":{"type":"UriEncode","inner_function":{"type":"Reference","value":"$.Code"}}}}}}},{"id":"Serialize_3","operator":{"type":"SerializerOp","config":{"template":"?sm_0 <http://www.w3.org/2000/01/rdf-schema#label> ?pom_0_0_om_0 .","format":"NQuads"}}},{"id":"Sink_4","operator":{"type":"TargetOp","config":{"target_type":"StdOut","data_format":"NQuads"}}},{"id":"ExtendOperator_5","operator":{"type":"ExtendOp","config":{"sm_1":{"type":"Iri","base_iri":"","inner_function":{"type":"Concatenate","left_value":{"type":"Concatenate","left_value":{"type":"Nop"},"separator":"","right_value":{"type":"Constant","value":"http://example.com/"}},"separator":"","right_value":{"type":"UriEncode","inner_function":{"type":"Reference","value":"$.Code"}}}},"pom_1_0_om_0":{"type":"Literal","inner_function":{"type":"Reference","value":"$.Name"},"dtype_function":null,"langtype_function":{"type":"Constant","value":"es"}}}}},{"id":"Serialize_6","operator":{"type":"SerializerOp","config":{"template":"?sm_1 <http://www.w3.org/2000/01/rdf-schema#label> ?pom_1_0_om_0 .","format":"NQuads"}}},{"id":"Sink_7","operator":{"type":"TargetOp","config":{"target_type":"StdOut","data_format":"NQuads"}}}],"node_holes":[],"edge_property":"directed","edges":[[1,2,{"fragment":"default","direction":"Center"}],[2,3,{"fragment":"default","direction":"Center"}],[3,4,{"fragment":"default","direction":"Center"}],[0,5,{"fragment":"default","direction":"Center"}],[5,6,{"fragment":"default","direction":"Center"}],[6,7,{"fragment":"default","direction":"Center"}]]}