{"nodes":[{"id":"Source_0","operator":{"type":"SourceOp","config":{"access":{"root":"http://w3id.org/rml/MappingDirectory","path":"student.json"},"source_type":"File","root_iterator":{"reference":"$.students[*]","reference_formulation":"JSONPath","fields":[{"alias":"$.ID","absolute_path":"$.ID","reference":"$.ID","constant":null,"iterator":null,"reference_formulation":"JSONPath","inner_fields":[]},{"alias":"$.Name","absolute_path":"$.Name","reference":"$.Name","constant":null,"iterator":null,"reference_formulation":"JSONPath","inner_fields":[]}],"alias":null}}}},{"id":"Source_1","operator":{"type":"SourceOp","config":{"access":{"root":"http://w3id.org/rml/MappingDirectory","path":"sport.json"},"source_type":"File","root_iterator":{"reference":"$.sports[*]","reference_formulation":"JSONPath","fields":[{"alias":"$.Name","absolute_path":"$.Name","reference":"$.Name","constant":null,"iterator":null,"reference_formulation":"JSONPath","inner_fields":[]},{"alias":"$.ID","absolute_path":"$.ID","reference":"$.ID","constant":null,"iterator":null,"reference_formulation":"JSONPath","inner_fields":[]}],"alias":null}}}},{"id":"RenameOp_2","operator":{"type":"RenameOp","config":{"alias":"join_alias"}}},{"id":"Join_3","operator":{"type":"JoinOp","config":{"left_right_attr_pairs":[],"join_type":"InnerJoin","predicate_type":"Equal"}}},{"id":"ExtendOp_4","operator":{"type":"ExtendOp","config":{"sm_0":{"type":"Iri","base_iri":"","inner_function":{"type":"Concatenate","left_value":{"type":"Concatenate","left_value":{"type":"Nop"},"separator":"","right_value":{"type":"Constant","value":"http://example.com/resource/student_"}},"separator":"","right_value":{"type":"UriEncode","inner_function":{"type":"Reference","value":"$.ID"}}}},"sm_1_obj":{"type":"Iri","base_iri":"","inner_function":{"type":"Concatenate","left_value":{"type":"Concatenate","left_value":{"type":"Nop"},"separator":"","right_value":{"type":"Constant","value":"http://example.com/resource/sport_"}},"separator":"","right_value":{"type":"UriEncode","inner_function":{"type":"Reference","value":"join_alias.$.ID"}}}}}}},{"id":"Serialize_5","operator":{"type":"SerializerOp","config":{"template":"?sm_0 <http://example.com/ontology/practises> ?sm_1_obj .","format":"NQuads"}}},{"id":"Sink_6","operator":{"type":"TargetOp","config":{"target_type":"StdOut","data_format":"NQuads"}}},{"id":"ExtendOperator_7","operator":{"type":"ExtendOp","config":{"sm_1":{"type":"Iri","base_iri":"","inner_function":{"type":"Concatenate","left_value":{"type":"Concatenate","left_value":{"type":"Nop"},"separator":"","right_value":{"type":"Constant","value":"http://example.com/resource/sport_"}},"separator":"","right_value":{"type":"UriEncode","inner_function":{"type":"Reference","value":"$.ID"}}}},"pom_1_0_om_0":{"type":"Literal","inner_function":{"type":"Reference","value":"$.Name"},"dtype_function":null,"langtype_function":null}}}},{"id":"Serialize_8","operator":{"type":"SerializerOp","config":{"template":"?sm_1 <http://www.w3.org/1999/02/22-rdf-syntax-ns#type> <http://example.com/ontology/Sport> .\n?sm_1 <http://www.w3.org/2000/01/rdf-schema#label> ?pom_1_0_om_0 .","format":"NQuads"}}},{"id":"Sink_9","operator":{"type":"TargetOp","config":{"target_type":"StdOut","data_format":"NQuads"}}},{"id":"ExtendOperator_10","operator":{"type":"ExtendOp","config":{"sm_0":{"type":"Iri","base_iri":"","inner_function":{"type":"Concatenate","left_value":{"type":"Concatenate","left_value":{"type":"Nop"},"separator":"","right_value":{"type":"Constant","value":"http://example.com/resource/student_"}},"separator":"","right_value":{"type":"UriEncode","inner_function":{"type":"Reference","value":"$.ID"}}}},"pom_0_0_om_0":{"type":"Literal","inner_function":{"type":"Reference","value":"$.Name"},"dtype_function":null,"langtype_function":null}}}},{"id":"Serialize_11","operator":{"type":"SerializerOp","config":{"template":"?sm_0 <http://www.w3.org/1999/02/22-rdf-syntax-ns#type> <http://example.com/ontology/Student> .\n?sm_0 <http://xmlns.com/foaf/0.1/name> ?pom_0_0_om_0 .","format":"NQuads"}}},{"id":"Sink_12","operator":{"type":"TargetOp","config":{"target_type":"StdOut","data_format":"NQuads"}}}],"node_holes":[],"edge_property":"directed","edges":[[1,2,{"fragment":"default","direction":"Center"}],[0,3,{"fragment":"join_alias","direction":"Left"}],[2,3,{"fragment":"join_alias","direction":"Right"}],[3,4,{"fragment":"default","direction":"Center"}],[4,5,{"fragment":"default","direction":"Center"}],[5,6,{"fragment":"default","direction":"Center"}],[1,7,{"fragment":"default","direction":"Center"}],[7,8,{"fragment":"default","direction":"Center"}],[8,9,{"fragment":"default","direction":"Center"}],[0,10,{"fragment":"default","direction":"Center"}],[10,11,{"fragment":"default","direction":"Center"}],[11,12,{"fragment":"default","direction":"Center"}]]}