{"nodes":[{"id":"Source_0","operator":{"type":"SourceOp","config":{"access":{"path":"data.json","root":"http://w3id.org/rml/MappingDirectory"},"source_type":"File","root_iterator":{"reference":"$.*","reference_formulation":"JSONPath","fields":[{"alias":"$.graph","absolute_path":"$.graph","reference":"$.graph","constant":null,"iterator":null,"reference_formulation":"JSONPath","inner_fields":[]},{"alias":"$.id","absolute_path":"$.id","reference":"$.id","constant":null,"iterator":null,"reference_formulation":"JSONPath","inner_fields":[]}],"alias":null}}}},{"id":"ExtendOperator_1","operator":{"type":"ExtendOp","config":{"pom_0_0_gm_0":{"type":"Iri","base_iri":"","inner_function":{"type":"Concatenate","left_value":{"type":"Concatenate","left_value":{"type":"Nop"},"separator":"","right_value":{"type":"Constant","value":"g/"}},"separator":"","right_value":{"type":"UriEncode","inner_function":{"type":"Reference","value":"$.graph"}}}},"sm_0":{"type":"Iri","base_iri":"","inner_function":{"type":"Concatenate","left_value":{"type":"Concatenate","left_value":{"type":"Nop"},"separator":"","right_value":{"type":"Constant","value":"e/"}},"separator":"","right_value":{"type":"UriEncode","inner_function":{"type":"Reference","value":"$.id"}}}},"pom_0_0_om_0":{"type":"BlankNode","inner_function":{"type":"Concatenate","left_value":{"type":"Concatenate","left_value":{"type":"Nop"},"separator":"","right_value":{"type":"Constant","value":"l/"}},"separator":"","right_value":{"type":"UriEncode","inner_function":{"type":"Reference","value":"$.id"}}}}}}},{"id":"Serialize_2","operator":{"type":"SerializerOp","config":{"template":"?sm_0 <http://example.com/ns#with> ?pom_0_0_om_0 ?pom_0_0_gm_0 .","format":"NQuads"}}},{"id":"Sink_3","operator":{"type":"TargetOp","config":{"target_type":"StdOut","data_format":"NQuads"}}}],"node_holes":[],"edge_property":"directed","edges":[[0,1,{"fragment":"default","direction":"Center"}],[1,2,{"fragment":"default","direction":"Center"}],[2,3,{"fragment":"default","direction":"Center"}]]}