{"nodes":[{"id":"Source_0","operator":{"type":"SourceOp","config":{"access":{"path":"companies.xml","root":"http://w3id.org/rml/MappingDirectory"},"source_type":"File","root_iterator":{"reference":"/companies/company/departments/department/employees/employee","reference_formulation":{"XMLPath":{"namespaces":[]}},"fields":[{"alias":"name","absolute_path":"name","reference":"name","constant":null,"iterator":null,"reference_formulation":{"XMLPath":{"namespaces":[]}},"inner_fields":[]},{"alias":"skills/skill","absolute_path":"skills/skill","reference":"skills/skill","constant":null,"iterator":null,"reference_formulation":{"XMLPath":{"namespaces":[]}},"inner_fields":[]}],"alias":null}}}},{"id":"ExtendOperator_1","operator":{"type":"ExtendOp","config":{"pom_0_0_om_0":{"type":"Literal","inner_function":{"type":"Reference","value":"skills/skill"},"dtype_function":null,"langtype_function":null},"sm_0":{"type":"Iri","base_iri":"http://example.com/rules/","inner_function":{"type":"Concatenate","left_value":{"type":"Concatenate","left_value":{"type":"Nop"},"separator":"","right_value":{"type":"Constant","value":"http://example.org/"}},"separator":"","right_value":{"type":"UriEncode","inner_function":{"type":"Reference","value":"name"}}}}}}},{"id":"Serialize_2","operator":{"type":"SerializerOp","config":{"template":"?sm_0 <http://example.com/skill> ?pom_0_0_om_0 .","format":"NQuads"}}},{"id":"Sink_3","operator":{"type":"TargetOp","config":{"target_type":"StdOut","data_format":"NQuads"}}}],"node_holes":[],"edge_property":"directed","edges":[[0,1,{"fragment":"default","direction":"Center"}],[1,2,{"fragment":"default","direction":"Center"}],[2,3,{"fragment":"default","direction":"Center"}]]}