{"nodes":[{"id":"Source_0","operator":{"type":"SourceOp","config":{"access":{"path":"Friends.json","root":"http://w3id.org/rml/MappingDirectory"},"source_type":"File","root_iterator":{"reference":"$[*]","reference_formulation":"JSONPath","fields":[{"alias":"$.id","absolute_path":"$.id","reference":"$.id","constant":null,"iterator":null,"reference_formulation":"JSONPath","inner_fields":[]},{"alias":"$.name","absolute_path":"$.name","reference":"$.name","constant":null,"iterator":null,"reference_formulation":"JSONPath","inner_fields":[]},{"alias":"$.age","absolute_path":"$.age","reference":"$.age","constant":null,"iterator":null,"reference_formulation":"JSONPath","inner_fields":[]}],"alias":null}}}},{"id":"ExtendOperator_1","operator":{"type":"ExtendOp","config":{"pom_0_0_om_0":{"type":"Literal","inner_function":{"type":"Reference","value":"$.name"},"dtype_function":null,"langtype_function":null},"pom_0_1_om_0":{"type":"Literal","inner_function":{"type":"Reference","value":"$.age"},"dtype_function":null,"langtype_function":null},"sm_0":{"type":"Iri","base_iri":"http://example.com/rules/","inner_function":{"type":"Concatenate","left_value":{"type":"Concatenate","left_value":{"type":"Nop"},"separator":"","right_value":{"type":"Constant","value":"http://example.org/"}},"separator":"","right_value":{"type":"UriEncode","inner_function":{"type":"Reference","value":"$.id"}}}}}}},{"id":"Serialize_2","operator":{"type":"SerializerOp","config":{"template":"?sm_0 <http://xmlns.com/foaf/0.1/age> ?pom_0_1_om_0 .\n?sm_0 <http://xmlns.com/foaf/0.1/name> ?pom_0_0_om_0 .","format":"NQuads"}}},{"id":"Sink_3","operator":{"type":"TargetOp","config":{"target_type":"StdOut","data_format":"NQuads"}}}],"node_holes":[],"edge_property":"directed","edges":[[0,1,{"fragment":"default","direction":"Center"}],[1,2,{"fragment":"default","direction":"Center"}],[2,3,{"fragment":"default","direction":"Center"}]]}