{"nodes":[{"id":"Source_0","operator":{"type":"SourceOp","config":{"access":{"root":"http://w3id.org/rml/MappingDirectory","path":"data.json"},"source_type":"File","root_iterator":{"reference":"$[*]","reference_formulation":"JSONPath","fields":[{"alias":"$.region","absolute_path":"$.region","reference":"$.region","constant":null,"iterator":null,"reference_formulation":"JSONPath","inner_fields":[]},{"alias":"$.language","absolute_path":"$.language","reference":"$.language","constant":null,"iterator":null,"reference_formulation":"JSONPath","inner_fields":[]},{"alias":"$.ID","absolute_path":"$.ID","reference":"$.ID","constant":null,"iterator":null,"reference_formulation":"JSONPath","inner_fields":[]},{"alias":"$.label","absolute_path":"$.label","reference":"$.label","constant":null,"iterator":null,"reference_formulation":"JSONPath","inner_fields":[]}],"alias":null}}}},{"id":"ExtendOperator_1","operator":{"type":"ExtendOp","config":{"pom_0_0_om_0":{"type":"Literal","inner_function":{"type":"Reference","value":"$.label"},"dtype_function":null,"langtype_function":{"type":"Concatenate","left_value":{"type":"Concatenate","left_value":{"type":"Concatenate","left_value":{"type":"Nop"},"separator":"","right_value":{"type":"Reference","value":"$.language"}},"separator":"","right_value":{"type":"Constant","value":"-"}},"separator":"","right_value":{"type":"Reference","value":"$.region"}}},"sm_0":{"type":"Iri","base_iri":"","inner_function":{"type":"Concatenate","left_value":{"type":"Concatenate","left_value":{"type":"Nop"},"separator":"","right_value":{"type":"Constant","value":"http://example.com/"}},"separator":"","right_value":{"type":"UriEncode","inner_function":{"type":"Reference","value":"$.ID"}}}}}}},{"id":"Serialize_2","operator":{"type":"SerializerOp","config":{"template":"?sm_0 <http://www.w3.org/2000/01/rdf-schema#label> ?pom_0_0_om_0 .","format":"NQuads"}}},{"id":"Sink_3","operator":{"type":"TargetOp","config":{"target_type":"StdOut","data_format":"NQuads"}}}],"node_holes":[],"edge_property":"directed","edges":[[0,1,{"fragment":"default","direction":"Center"}],[1,2,{"fragment":"default","direction":"Center"}],[2,3,{"fragment":"default","direction":"Center"}]]}