{"nodes":[{"id":"Source_0","operator":{"type":"SourceOp","config":{"access":{"root":"http://w3id.org/rml/MappingDirectory","path":"people.json"},"source_type":"File","root_iterator":{"reference":"$.people[*]","reference_formulation":"JSONPath","fields":[{"alias":"name","absolute_path":"name","reference":"$.name","constant":null,"iterator":null,"reference_formulation":"JSONPath","inner_fields":[]},{"alias":"item","absolute_path":"item","reference":null,"constant":null,"iterator":"$.items[*]","reference_formulation":"JSONPath","inner_fields":[{"alias":"type","absolute_path":"item.type","reference":"$.type","constant":null,"iterator":null,"reference_formulation":"JSONPath","inner_fields":[]}]}],"alias":null}}}},{"id":"ExtendOperator_1","operator":{"type":"ExtendOp","config":{"sm_0":{"type":"Iri","base_iri":"","inner_function":{"type":"Concatenate","left_value":{"type":"Concatenate","left_value":{"type":"Nop"},"separator":"","right_value":{"type":"Constant","value":"http://example.org/person/"}},"separator":"","right_value":{"type":"UriEncode","inner_function":{"type":"Reference","value":"name"}}}},"pom_0_0_om_0":{"type":"Iri","base_iri":"","inner_function":{"type":"Concatenate","left_value":{"type":"Concatenate","left_value":{"type":"Concatenate","left_value":{"type":"Concatenate","left_value":{"type":"Nop"},"separator":"","right_value":{"type":"Constant","value":"http://example.org/person/"}},"separator":"","right_value":{"type":"UriEncode","inner_function":{"type":"Reference","value":"name"}}},"separator":"","right_value":{"type":"Constant","value":"/item/"}},"separator":"","right_value":{"type":"UriEncode","inner_function":{"type":"Reference","value":"item.type"}}}}}}},{"id":"Serialize_2","operator":{"type":"SerializerOp","config":{"template":"?sm_0 <http://example.org/hasItem> ?pom_0_0_om_0 .","format":"NQuads"}}},{"id":"Sink_3","operator":{"type":"TargetOp","config":{"target_type":"StdOut","data_format":"NQuads"}}}],"node_holes":[],"edge_property":"directed","edges":[[0,1,{"fragment":"default","direction":"Center"}],[1,2,{"fragment":"default","direction":"Center"}],[2,3,{"fragment":"default","direction":"Center"}]]}