{"nodes":[{"id":"Source_0","operator":{"type":"SourceOp","config":{"access":{"path":"persons.json","root":"http://w3id.org/rml/MappingDirectory"},"source_type":"File","root_iterator":{"reference":"$.persons[*]","reference_formulation":"JSONPath","fields":[{"alias":"$.amount","absolute_path":"$.amount","reference":"$.amount","constant":null,"iterator":null,"reference_formulation":"JSONPath","inner_fields":[]},{"alias":"$.fname","absolute_path":"$.fname","reference":"$.fname","constant":null,"iterator":null,"reference_formulation":"JSONPath","inner_fields":[]},{"alias":"$.lname","absolute_path":"$.lname","reference":"$.lname","constant":null,"iterator":null,"reference_formulation":"JSONPath","inner_fields":[]},{"alias":"$.amount","absolute_path":"$.amount","reference":"$.amount","constant":null,"iterator":null,"reference_formulation":"JSONPath","inner_fields":[]}],"alias":null}}}},{"id":"ExtendOperator_1","operator":{"type":"ExtendOp","config":{"pom_1_0_om_0":{"type":"Literal","inner_function":{"type":"Reference","value":"$.amount"},"dtype_function":null,"langtype_function":null},"sm_0":{"type":"Iri","base_iri":"http://example2.com/","inner_function":{"type":"Concatenate","left_value":{"type":"Nop"},"separator":"","right_value":{"type":"UriEncode","inner_function":{"type":"Reference","value":"$.fname"}}}},"pom_0_0_om_0":{"type":"Literal","inner_function":{"type":"Reference","value":"$.amount"},"dtype_function":null,"langtype_function":null},"sm_1":{"type":"Iri","base_iri":"http://example2.com/","inner_function":{"type":"Concatenate","left_value":{"type":"Nop"},"separator":"","right_value":{"type":"UriEncode","inner_function":{"type":"Reference","value":"$.lname"}}}}}}},{"id":"Serialize_2","operator":{"type":"SerializerOp","config":{"template":"?sm_0 <http://example.com/amount> ?pom_0_0_om_0 .\n?sm_1 <http://example.com/amount> ?pom_1_0_om_0 .","format":"NQuads"}}},{"id":"Sink_3","operator":{"type":"TargetOp","config":{"target_type":"StdOut","data_format":"NQuads"}}}],"node_holes":[],"edge_property":"directed","edges":[[0,1,{"fragment":"default","direction":"Center"}],[1,2,{"fragment":"default","direction":"Center"}],[2,3,{"fragment":"default","direction":"Center"}]]}